<?xml version="1.0" encoding="UTF-8"?>
<command id="create-adr"
    xmlns:xsi="http://www.w3.org/2001/XMLSchema-instance"
    xsi:noNamespaceSchemaLocation="../commands.xsd">

    <metadata>
        <authors>
            <author>Juan Antonio Breña Moral</author>
        </authors>
        <version>0.19.0-SNAPSHOT</version>
        <description>Create a repository ADR for an approved architectural decision.</description>
        <argument-hint>[decision-source]</argument-hint>
        <model>inherit</model>
        <agent>plinth-architect</agent>
        <tools>
            <tools-list>
                <tool>Read</tool>
                <tool>Write</tool>
                <tool>Edit</tool>
            </tools-list>
        </tools>
    </metadata>

    <goal><![CDATA[
Record an important architectural decision, its context, alternatives, and consequences.

## Usage

```text
/create-adr <decision-source>
```

## Accepted Inputs

- Approved design exploration, issue, specification, or implementation plan
- Existing architecture constraints and related ADRs

## Owning Agent

`@plinth-architect`

## Associated Skills

- `030-architecture-adr-general`
]]></goal>

    <steps>
        <step number="1">Confirm the decision scope with `030-architecture-adr-general`.</step>
        <step number="2">Gather context, constraints, considered alternatives, and consequences.</step>
        <step number="3">Draft the ADR using the repository convention.</step>
        <step number="4">Check consistency with related issues, designs, specifications, and ADRs.</step>
        <step number="5">Present the ADR for approval before finalizing it.</step>
    </steps>

    <output-format>
        <output-format-list>
            <output-format-item>One repository-compliant ADR</output-format-item>
            <output-format-item>Decision status, rationale, alternatives, and consequences</output-format-item>
            <output-format-item>Links to relevant source artifacts</output-format-item>
        </output-format-list>
    </output-format>

    <safeguards>
        <safeguards-list>
            <safeguards-item>Do not create an ADR for a decision that has not been made.</safeguards-item>
            <safeguards-item>Do not invent alternatives or constraints.</safeguards-item>
            <safeguards-item>Do not modify unrelated ADRs.</safeguards-item>
        </safeguards-list>
    </safeguards>
</command>
